{"$schema":"https://json-schema.org/draft/2020-12/schema","type":"object","additionalProperties":false,"required":["$schema","supportedOperatingSystems","supportedArchitectures","distributionIncludesPluginInstaller","claims"],"properties":{"$schema":{"const":"../schemas/product-scope.schema.json"},"supportedOperatingSystems":{"const":["Windows 11"]},"supportedArchitectures":{"const":["x64"]},"distributionIncludesPluginInstaller":{"const":false},"claims":{"type":"object","additionalProperties":false,"required":["securityAudit","sandbox","publicService"],"properties":{"securityAudit":{"const":"not-claimed"},"sandbox":{"const":"partial-restriction"},"publicService":{"const":"not-provided"}}}}}
